{
  "handle": "fake_retail_sparse",
  "tier": "sparse",
  "sector": "retail_lifestyle",
  "purpose": "fake_platform_sector_coverage",
  "do_not_aggregate": true,
  "_prov": {
    "source": "synthetic_fixture",
    "date_added": "2026-07-01",
    "confirmer": "system",
    "confidence": "experimental",
    "scope": "brand"
  }
}